Request_ID,Sample_Received_Date,Number_of_Tests,Test_Type,Test_Names,Final_CofA_Date,Revenue
edff6de2-efce-4f55-bb96-49501e952e5b,06/17/2024,10,Chemistry,"Sulfate, Chloride, Turbidity, Phosphate, Hardness, Alkalinity, pH, Nitrate, Heavy Metals, TOC",07/15/2024,1528.04
5a29ee3c-3edf-45ab-a732-bb9f7e483953,07/22/2024,2,Chemistry,"Heavy Metals, Chloride",08/15/2024,308.65
64fcf713-de4c-4e7d-9402-cf14afefca88,09/09/2023,1,Chemistry,Turbidity,09/17/2023,278.98
1bfcd0d8-a983-4e38-869d-ac794adb94d1,10/10/2024,3,Chemistry,"Turbidity, TOC, Hardness",10/13/2024,561.69
a40bf632-0ded-4436-8176-ad4802952a68,03/28/2023,8,Microbiology,"Pseudomonas aeruginosa, Heterotrophic Plate Count, Legionella, Total Coliforms, Cryptosporidium, Enterococci, Clostridium perfringens, E. coli",04/04/2023,2120.65
7d2e2bac-e2fd-4a9f-91c7-2f56720c8c47,01/06/2023,7,Microbiology,"E. coli, Pseudomonas aeruginosa, Cryptosporidium, Total Coliforms, Legionella, Clostridium perfringens, Heterotrophic Plate Count",01/21/2023,907.08
d04b55ac-6a13-4a31-ab88-2b18b1b28cc4,06/14/2023,2,Chemistry,"Hardness, pH",07/02/2023,504.41
9c051f06-ea87-410d-a9a0-b16edcfdafda,07/22/2023,10,Chemistry,"Sulfate, pH, TOC, Hardness, Chloride, Alkalinity, Nitrate, Turbidity, Heavy Metals, Phosphate",08/06/2023,NaN
15113f6b-e35e-402f-9f83-c6b163216461,04/04/2025,6,Chemistry,NaN,04/25/2025,1489.32
620c5f26-f1e7-4e77-941f-b8f993a3488e,09/04/2024,7,Microbiology,"E. coli, Total Coliforms, Cryptosporidium, Enterococci, Legionella, Clostridium perfringens, Pseudomonas aeruginosa",09/10/2024,1308.76
4d14eda1-e858-4e25-92b6-3599d05d4f96,05/27/2024,10,Chemistry,"TOC, Sulfate, Hardness, Nitrate, Alkalinity, Turbidity, Phosphate, Chloride, Heavy Metals, pH",06/17/2024,1363.5
fe9da1ee-5854-42d1-9bd1-9f3e032d462a,05/25/2023,1,Chemistry,Chloride,06/23/2023,124.04
baf353e7-66a1-400d-ae62-56114e74474b,05/16/2024,10,Microbiology,"Cryptosporidium, Fecal Streptococci, E. coli, Total Coliforms, Enterococci, Legionella, Pseudomonas aeruginosa, Giardia, Heterotrophic Plate Count, Clostridium perfringens",06/04/2024,2976.36
53d07a63-cad8-4396-9915-a354c754e56e,11/27/2024,5,Microbio,NaN,12/20/2024,1112.77
66ae2b5d-b5bb-45f5-9a7a-734b3eb999b0,01/09/2023,2,Microbiology,"Clostridium perfringens, Giardia",01/26/2023,239.34
eabad6db-589b-4be6-b1f4-aa263bb8eea6,05/12/2024,8,Chemistry,"Nitrate, TOC, Sulfate, Phosphate, pH, Chloride, Turbidity, Alkalinity",06/11/2024,2369.76
9dd0a61e-a804-422c-ba30-a81cc7869c54,02/18/2025,4,Microbiology,"Heterotrophic Plate Count, Pseudomonas aeruginosa, Fecal Streptococci, Enterococci",03/14/2025,592.83
829dacb5-da8e-48ea-a0c3-3280d66c0095,09/28/2023,5,Microbiology,"Cryptosporidium, Giardia, Legionella, Fecal Streptococci, Total Coliforms",10/16/2023,NaN
4aea790e-142f-4565-aa5c-1f3aa965aff3,03/16/2023,4,Chemistry,"Hardness, Nitrate, Alkalinity, Chloride",04/05/2023,454.97
08a53f7e-fc3e-4c95-9ac9-1c9679d27335,02/17/2023,8,Microbiology,"Clostridium perfringens, Legionella, E. coli, Fecal Streptococci, Pseudomonas aeruginosa, Giardia, Total Coliforms, Cryptosporidium",03/10/2023,1171.18
b41bc4a9-2fb8-4f0e-9f16-b2235f199fb9,06/30/2024,6,Chemistry,"TOC, Hardness, Chloride, Phosphate, Sulfate, Turbidity",07/06/2024,820.44
772f5231-b210-4976-b10d-a5437abe869f,12/21/2023,8,Microbiology,"Heterotrophic Plate Count, E. coli, Total Coliforms, Giardia, Cryptosporidium, Fecal Streptococci, Clostridium perfringens, Pseudomonas aeruginosa",01/20/2024,1841.68
da073597-654e-46bb-9783-624627428a14,08/01/2024,9,Chemistry,"Phosphate, Sulfate, Turbidity, Nitrate, Heavy Metals, Alkalinity, Chloride, pH, Hardness",08/14/2024,2368.74
71d68ba3-43fb-4271-9e50-1cec615abb64,03/05/2023,4,Chemistry,"TOC, Hardness, Sulfate, Chloride",04/04/2023,575.2
05876dc7-820f-4614-8253-306423c99289,03/29/2025,5,Chemistry,"Hardness, Heavy Metals, Nitrate, Alkalinity, TOC",04/06/2025,NaN
df1eeb21-eb9d-484c-8f68-62dcac520133,02/14/2023,10,Chemistry,"Alkalinity, Sulfate, TOC, Phosphate, pH, Turbidity, Chloride, Hardness, Heavy Metals, Nitrate",02/19/2023,2251.87
7f93b3ac-adfc-4601-b029-b04f664900f0,07/19/2024,1,Microbiology,NaN,08/10/2024,186.6
e6f37276-bc25-4ec9-b358-53c8f87fa62b,01/31/2025,1,Microbiology,NaN,02/14/2025,NaN
ae2f8155-7e90-4e67-9e96-83159996e559,06/20/2023,9,Chemistry,"Sulfate, Alkalinity, Chloride, Heavy Metals, Nitrate, Phosphate, TOC, Hardness, pH",07/13/2023,1575.66
bcfecbfd-6b4f-4004-9fbe-56639904fc55,07/20/2023,3,Chemistry,"Sulfate, Hardness, Heavy Metals",08/03/2023,666.14
291afe3f-93e1-40a6-89f8-6dcff4a4a75a,10/13/2024,8,Chemistry,"pH, Sulfate, Nitrate, Hardness, Alkalinity, Phosphate, Turbidity, Chloride",11/03/2024,1545.58
4984df63-1fbc-4af3-80e3-1c60b4896381,12/29/2024,4,Microbiology,"Pseudomonas aeruginosa, Fecal Streptococci, Giardia, Total Coliforms",01/13/2025,354.38
c5aea929-b777-455a-a479-d020d8ec438e,06/24/2024,9,Microbiology,"Heterotrophic Plate Count, Fecal Streptococci, Total Coliforms, Clostridium perfringens, Giardia, Legionella, Enterococci, Pseudomonas aeruginosa, E. coli",07/17/2024,1482.53
bf90e6a3-e22e-494a-a2c3-fd1f8b71769c,01/02/2024,1,Microbiology,E. coli,01/27/2024,158.37
ab6e35ec-aa22-457c-8c10-8314125af774,02/04/2023,5,Microbiology,"Giardia, Heterotrophic Plate Count, E. coli, Fecal Streptococci, Enterococci",02/27/2023,1409.67
bdf9c22e-cd2c-41f5-b4c6-320574a9a88d,05/27/2024,9,Microbiology,"Heterotrophic Plate Count, Pseudomonas aeruginosa, Fecal Streptococci, Legionella, Enterococci, Cryptosporidium, Clostridium perfringens, E. coli, Total Coliforms",06/03/2024,1938.94
6c9828e1-0f48-40d4-9b66-dafc2d5db1be,02/21/2024,7,Microbiology,"Heterotrophic Plate Count, Legionella, Clostridium perfringens, Enterococci, Giardia, Fecal Streptococci, Total Coliforms",03/06/2024,1979.72
38260ce0-ec44-40ce-896f-bd7b0c93b5f3,07/30/2023,10,Chemistry,"Alkalinity, Nitrate, Heavy Metals, Hardness, pH, Phosphate, Chloride, Sulfate, Turbidity, TOC",08/22/2023,2062.0
3aa38e71-e0b2-4bb3-b4aa-ffca41eaa203,09/04/2023,10,Chemistry,"TOC, pH, Heavy Metals, Alkalinity, Sulfate, Hardness, Chloride, Turbidity, Phosphate, Nitrate",10/03/2023,1020.73
de19d3ee-49cd-40ab-a3ac-f5e56cb94502,02/14/2023,9,Microbiology,"Cryptosporidium, E. coli, Pseudomonas aeruginosa, Enterococci, Fecal Streptococci, Heterotrophic Plate Count, Clostridium perfringens, Giardia, Legionella",03/14/2023,2485.24
4dab66b6-0d01-4b38-a09c-0ee8bb59384b,09/11/2024,5,Microbiology,"Enterococci, Legionella, Total Coliforms, Heterotrophic Plate Count, Pseudomonas aeruginosa",09/18/2024,941.63
348e973a-f9db-4363-853c-45232f6689ba,04/27/2024,10,Chemistry,"Sulfate, Turbidity, Heavy Metals, pH, Nitrate, Chloride, TOC, Alkalinity, Hardness, Phosphate",05/18/2024,2847.71
afd7eab9-b105-4f1c-b316-2e56f2741e60,03/11/2023,7,Microbiology,"Heterotrophic Plate Count, E. coli, Giardia, Total Coliforms, Cryptosporidium, Fecal Streptococci, Legionella",04/05/2023,637.73
03fbd36c-3f5e-4c6a-9a4a-e08f3d6404b7,10/07/2023,10,Microbiology,"Legionella, E. coli, Clostridium perfringens, Pseudomonas aeruginosa, Enterococci, Fecal Streptococci, Cryptosporidium, Heterotrophic Plate Count, Total Coliforms, Giardia",10/12/2023,1822.42
b3476eda-444c-43d5-b971-44d17e9dd6d2,04/13/2024,4,Microbiology,"E. coli, Pseudomonas aeruginosa, Total Coliforms, Enterococci",04/20/2024,887.42
2b4e5d53-fd28-4c76-a44e-ec2a829a0174,06/21/2023,1,Chemistry,Phosphate,07/20/2023,284.34
d7209230-7ec4-42b3-bf75-96a7706247b8,04/06/2023,5,Chemistry,"Sulfate, Nitrate, Heavy Metals, Alkalinity, Chloride",NaN,758.32
b4bb097f-c8c7-4f9f-a57d-8b7387b278fa,08/09/2024,9,Microbiology,"Legionella, Fecal Streptococci, Giardia, Heterotrophic Plate Count, Clostridium perfringens, Total Coliforms, Enterococci, Pseudomonas aeruginosa, E. coli",08/20/2024,1018.83
fe0cd10a-80b5-44c7-819e-8f842ce6eb30,07/02/2024,6,Chemistry,"Turbidity, Alkalinity, Sulfate, Chloride, TOC, Nitrate",07/19/2024,1017.85
e282312a-fdc9-4842-9f17-2ed9adca2bee,01/07/2024,6,Microbiology,"Heterotrophic Plate Count, Clostridium perfringens, E. coli, Fecal Streptococci, Enterococci, Pseudomonas aeruginosa",01/30/2024,488.62
8a614a33-0153-4e8c-9e42-0297d87e3680,11/16/2024,10,Microbiology,"Giardia, Legionella, Heterotrophic Plate Count, Clostridium perfringens, Enterococci, E. coli, Fecal Streptococci, Pseudomonas aeruginosa, Cryptosporidium, Total Coliforms",11/19/2024,2818.19
843a0e76-b683-4815-99c3-fd0d7d525a61,03/11/2025,5,Microbiology,"Total Coliforms, Enterococci, Giardia, Pseudomonas aeruginosa, E. coli",03/16/2025,1333.76
1da5253b-d5b4-4936-a307-ab5576fe98c9,06/08/2023,3,Chemistry,"Phosphate, Sulfate, Heavy Metals",06/22/2023,499.59
cec1265e-948a-44d5-a877-37ebbf59ba69,11/12/2024,8,Chemistry,"Turbidity, Nitrate, pH, Alkalinity, Heavy Metals, Sulfate, TOC, Phosphate",11/24/2024,1936.69
7adb6f72-e17a-46ca-b529-5c22bf279ec2,09/09/2024,10,Microbiology,"Heterotrophic Plate Count, Enterococci, Clostridium perfringens, Giardia, Cryptosporidium, Fecal Streptococci, Total Coliforms, E. coli, Legionella, Pseudomonas aeruginosa",10/08/2024,1029.83
43ecbdeb-b0b2-43dd-9298-c2b515e405b6,03/23/2024,7,Microbiology,"E. coli, Cryptosporidium, Total Coliforms, Heterotrophic Plate Count, Legionella, Pseudomonas aeruginosa, Fecal Streptococci",04/17/2024,1814.11
9834ecfa-3b73-49e1-a71a-9de59da873c7,12/23/2024,3,Chemistry,"Heavy Metals, Nitrate, Turbidity",12/30/2024,779.36
2d0ccacb-b2f3-42fc-9e6c-73bc37cbb4da,11/16/2023,10,Microbiology,"E. coli, Clostridium perfringens, Pseudomonas aeruginosa, Total Coliforms, Heterotrophic Plate Count, Cryptosporidium, Enterococci, Legionella, Fecal Streptococci, Giardia",NaN,1841.61
6f235143-fbe8-4dba-b7e7-b56f00e21a32,02/09/2024,5,Microbiology,"E. coli, Heterotrophic Plate Count, Fecal Streptococci, Giardia, Total Coliforms",02/19/2024,1470.35
c98cde12-186f-4cfe-8c40-4c50c7333c80,01/14/2025,3,Microbiology,"Fecal Streptococci, Total Coliforms, Legionella",02/03/2025,666.26
c3334bfc-2e3c-425d-8f4a-303faf8c96b2,02/06/2023,4,Chemistry,"Nitrate, Turbidity, TOC, Alkalinity",02/12/2023,344.87
bbd4e99e-7ef4-4e89-92a5-9bee1e5818a1,10/24/2023,5,Microbiology,"Enterococci, Heterotrophic Plate Count, Cryptosporidium, Pseudomonas aeruginosa, Giardia",11/21/2023,1375.42
6b4c2d47-08f4-44f1-9e02-26baad08d428,03/31/2023,3,Chemistry,"TOC, Nitrate, Heavy Metals",04/05/2023,NaN
4d2d970e-dc5f-4cef-ab8e-749dfb5a1603,08/26/2024,3,Chemistry,"Hardness, Alkalinity, Heavy Metals",09/21/2024,806.71
b565f423-dadf-4d5d-b344-18b6abf7d40c,11/30/2024,2,Chemistry,"Turbidity, Chloride",12/03/2024,570.81
3e67afb6-0a45-412a-9ab8-e99aa81ff72f,12/12/2024,10,Microbiology,"Total Coliforms, Legionella, Giardia, Cryptosporidium, Enterococci, E. coli, Fecal Streptococci, Heterotrophic Plate Count, Pseudomonas aeruginosa, Clostridium perfringens",12/27/2024,907.03
f5282b5c-8f22-4486-84c5-c444b84228b1,09/30/2024,4,Chemistry,"Hardness, Turbidity, Heavy Metals, TOC",10/26/2024,929.35
f413e8f3-923f-4da2-a9e1-166cff4faf39,07/16/2024,4,Microbiology,"Clostridium perfringens, Enterococci, Heterotrophic Plate Count, Fecal Streptococci",07/20/2024,670.02
0927a3a9-9bab-4d02-9754-da1485b619af,06/25/2023,2,Chemistry,"Sulfate, Chloride",07/18/2023,434.75
6fc6848d-c46b-4740-886a-fc28bdf5ac3b,06/27/2024,8,Chemistry,"Phosphate, Alkalinity, pH, Turbidity, Nitrate, Sulfate, TOC, Heavy Metals",07/02/2024,999.3
b5e7b207-af54-4ae8-b7f5-b64ef8bcfd70,12/06/2024,3,Microbiology,"Giardia, Pseudomonas aeruginosa, Fecal Streptococci",NaN,406.56
9d4585d0-0c09-4be3-87aa-0cbaedeae40c,01/23/2023,7,Microbiology,"Fecal Streptococci, Total Coliforms, Legionella, Pseudomonas aeruginosa, Cryptosporidium, Heterotrophic Plate Count, Clostridium perfringens",01/29/2023,1201.17
7f4cf9b8-1bb7-4d00-964b-f4aee76a45d6,11/11/2024,3,Microbiology,"Clostridium perfringens, E. coli, Fecal Streptococci",NaN,NaN
db1318ed-2e5b-4ac2-b3e8-f3ea56c6e3b1,09/01/2023,10,Microbiology,"Pseudomonas aeruginosa, E. coli, Enterococci, Heterotrophic Plate Count, Total Coliforms, Clostridium perfringens, Giardia, Legionella, Cryptosporidium, Fecal Streptococci",09/27/2023,2555.88
f00d50ed-c5cf-4422-8697-fed2fb5d8352,05/14/2024,4,Microbiology,"Giardia, Pseudomonas aeruginosa, Fecal Streptococci, Clostridium perfringens",05/19/2024,1139.91
26516224-8dbc-44dc-98e4-ee0ef049a3b5,12/15/2024,2,Microbiology,"Enterococci, Heterotrophic Plate Count",12/22/2024,595.33
db4bd248-09c8-48e5-8ed4-2e15d02d8a83,12/25/2024,7,Microbiology,"Clostridium perfringens, Enterococci, Cryptosporidium, Fecal Streptococci, Pseudomonas aeruginosa, Heterotrophic Plate Count, E. coli",12/30/2024,1577.45
2e0ffdff-1834-4c2e-901a-7dd21f427429,10/22/2023,1,Microbiology,Legionella,10/27/2023,NaN
17abe133-b344-490b-a71b-2d390449eb14,12/13/2023,2,Microbiology,"Heterotrophic Plate Count, Pseudomonas aeruginosa",01/10/2024,NaN
24d2a6e1-055a-48c4-9f2d-2f708f8af085,03/27/2025,2,Microbiology,"Legionella, Enterococci",04/06/2025,494.18
b1f1d1c6-0929-44e3-af1d-5c41a4d27153,17-02-2023,2,Chemistry,"Chloride, pH",03/19/2023,266.54
40b92f89-d556-444a-9ed7-756bf677a69c,02.23.2023,5,Chemistry,"pH, Sulfate, Hardness, Alkalinity, TOC",03/23/2023,1065.99
f5f86ff6-3836-4b47-b713-eb4484db42c0,10/23/2023,3,Chemistry,"Nitrate, Chloride, Alkalinity",10/27/2023,NaN
ea46bf32-6175-4e02-9246-138ebc071e20,10/28/2024,7,Microbiology,"E. coli, Heterotrophic Plate Count, Legionella, Cryptosporidium, Fecal Streptococci, Total Coliforms, Clostridium perfringens",11/09/2024,1934.14
662fd4ea-9480-428a-be5a-48bc4c7cd1b7,09/05/2024,2,Microbiology,"Total Coliforms, Clostridium perfringens",09/14/2024,195.43
8fb900da-1763-41c6-98bf-dcb32bc3ed9c,03/22/2024,4,Chemistry,"Phosphate, Hardness, pH, Turbidity",2024/04/16,435.54
b3acfdde-f910-431b-8d54-44d66cf53658,02/14/2023,5,Chemistry,"Heavy Metals, pH, Sulfate, Chloride, Hardness",NaN,579.72
a6bf6974-5200-4e34-81e7-6f3c6d21a9ef,01/25/2025,1,Microbiology,Fecal Streptococci,02/17/2025,200.99
9458012f-ca24-4f5a-a388-618dcc90eeed,13-04-2025,2,Chemistry,"Sulfate, Nitrate",05/12/2025,304.65
45566023-25dc-4e29-ac4b-adb459e3143a,02/19/2025,6,Chemistry,"Turbidity, pH, Hardness, Nitrate, TOC, Sulfate",03/17/2025,574.92
dfb5ef17-3f2b-454c-945c-babff293250b,07/16/2024,3,Microbiology,"Pseudomonas aeruginosa, Enterococci, Fecal Streptococci",28-07-2024,640.83
6e55f517-89c2-4061-bf43-5e59b3f21096,05/24/2024,10,Chemistry,"TOC, pH, Chloride, Heavy Metals, Phosphate, Turbidity, Sulfate, Hardness, Alkalinity, Nitrate",06/09/2024,2478.07
f6ec461a-62ae-4e7a-85ad-f78c76080462,11/25/2023,8,Chemistry,"Turbidity, Phosphate, Sulfate, pH, Hardness, Alkalinity, Heavy Metals, Nitrate",12/08/2023,1707.57
57067e19-451e-444e-addf-38499805df74,12/17/2023,10,Chemistry,"Heavy Metals, Chloride, Sulfate, Alkalinity, Hardness, Phosphate, pH, Turbidity, Nitrate, TOC",12/23/2023,NaN
05e1ef13-23e5-416c-8f98-195f13877cac,02/17/2025,10,Microbiology,"Giardia, Legionella, Cryptosporidium, Total Coliforms, Clostridium perfringens, Heterotrophic Plate Count, Enterococci, Pseudomonas aeruginosa, Fecal Streptococci, E. coli",02/21/2025,1239.52
645f101c-0f67-47c9-babd-8e636b8029ad,05/06/2024,9,Chemistry,"Chloride, Sulfate, Turbidity, pH, Phosphate, Nitrate, TOC, Hardness, Alkalinity",06/04/2024,1443.15
00484427-b56a-4df2-99a3-fd8dfe991305,12/30/2024,10,Microbiology,"Clostridium perfringens, Total Coliforms, Giardia, Cryptosporidium, Legionella, Enterococci, E. coli, Heterotrophic Plate Count, Pseudomonas aeruginosa, Fecal Streptococci",01/24/2025,NaN
8316ec70-ddc5-4833-880c-7821a7abfa2a,12/03/2024,6,Chemistry,"TOC, Alkalinity, Hardness, Heavy Metals, Nitrate, Turbidity",01/01/2025,1070.27
7a448d92-6d3c-4012-8fd3-48558c1a1da0,02/07/2025,8,Microbiology,NaN,NaN,5000
47f18523-158a-455f-a10f-7c137096daee,09/30/2023,7,Chemistry,"Chloride, Alkalinity, Nitrate, pH, Hardness, Sulfate, TOC",10/17/2023,1389.85
721adbe4-ae73-48fc-b3bc-c9f8a5a974d8,09/21/2023,1,Microbiology,Legionella,10/02/2023,269.68
5328b3fe-33b2-45d8-9f68-0dba409fdf01,01/21/2025,9,Microbiology,"E. coli, Cryptosporidium, Pseudomonas aeruginosa, Heterotrophic Plate Count, Total Coliforms, Legionella, Fecal Streptococci, Giardia, Clostridium perfringens",02/09/2025,1336.07
12d41888-7eae-4b91-843e-e3eff1e10c50,06/30/2023,9,Microbiology,"Pseudomonas aeruginosa, Clostridium perfringens, Cryptosporidium, Fecal Streptococci, Giardia, Enterococci, Total Coliforms, E. coli, Heterotrophic Plate Count",07/18/2023,1113.81
b03d5e9e-91d9-4c94-b04d-349cb991a07a,02/26/2024,4,Microbiology,"Legionella, Fecal Streptococci, E. coli, Pseudomonas aeruginosa",03/21/2024,951.18
b2e4aed2-02db-45b3-81f1-2ae2734ae08d,12/26/2023,4,Microbiology,"Legionella, Giardia, Total Coliforms, E. coli",01/24/2024,559.13
ac3c16bb-1986-4c44-8bd2-1468e963ad1d,07/07/2024,2,Microbiology,"Cryptosporidium, Total Coliforms",07/26/2024,586.98
3f35daf8-f970-4bf1-9e00-812a01cac16f,08/20/2023,4,Microbiology,"Enterococci, Pseudomonas aeruginosa, Total Coliforms, Clostridium perfringens",09/18/2023,712.51
600b82d3-d23d-4f73-8340-ca473d57ad47,09/18/2024,7,Microbiology,"Heterotrophic Plate Count, Clostridium perfringens, Giardia, Cryptosporidium, Pseudomonas aeruginosa, Fecal Streptococci, Total Coliforms",10/01/2024,10000
f90b04ae-e05f-4564-9d27-2c7ea93f5756,07/02/2024,1,Chemistry,Heavy Metals,07/15/2024,143.5
ab0c6c49-4369-4318-bd20-14b21d42fb8c,03/15/2025,8,Chemistry,"Heavy Metals, Turbidity, Alkalinity, TOC, Phosphate, Sulfate, Chloride, pH",04/01/2025,2215.68
bd1841bd-0d95-4ccf-b56f-a71d418f50a2,02/19/2024,6,Microbiology,"Giardia, Cryptosporidium, Clostridium perfringens, Pseudomonas aeruginosa, E. coli, Total Coliforms",03/10/2024,655.17
e126b6f8-7618-4022-b876-159c5144ec71,01/24/2023,9,Chemistry,"Nitrate, Heavy Metals, Chloride, Phosphate, Alkalinity, Turbidity, Sulfate, Hardness, TOC",01/27/2023,1543.63
e31e8540-f992-49ab-a98b-02e075a5f941,11.09.2023,2,Microbiology,"Enterococci, Fecal Streptococci",11/20/2023,544.62
afc129a4-8806-40f9-be36-382ea508d852,03/06/2025,9,Chemistry,"Sulfate, Nitrate, Heavy Metals, Chloride, Phosphate, Turbidity, Hardness, TOC, Alkalinity",04/03/2025,813.21
8cf36cd2-d03b-4521-919c-6997795f0764,08/28/2024,5,Microbiology,"E. coli, Cryptosporidium, Pseudomonas aeruginosa, Total Coliforms, Enterococci",09/22/2024,1466.29
1efa413e-ff8b-494f-992a-6b9a0160f261,01/02/2024,5,Chemistry,"Hardness, Alkalinity, TOC, Phosphate, Turbidity",01/19/2024,1488.94
a16b803c-fe1b-4ee9-be39-e7e5d5e7485f,11/05/2023,7,Chemistry,"Alkalinity, Sulfate, Nitrate, pH, TOC, Hardness, Turbidity",12/01/2023,1430.51
210e3eaf-e247-4c02-8872-b58f413f3bb2,04/08/2023,4,Chemistry,"Heavy Metals, Chloride, Alkalinity, Nitrate",04/20/2023,1051.55
1b4f47dc-c6c2-4066-9837-c418b4b71dac,10/26/2024,8,Microbiology,"Legionella, Heterotrophic Plate Count, E. coli, Cryptosporidium, Enterococci, Pseudomonas aeruginosa, Clostridium perfringens, Total Coliforms",11/22/2024,1340.82
d11f816f-2cef-4ca2-a9e7-134c58057aad,12/20/2024,1,Chemistry,Alkalinity,01/09/2025,272.99
23b8674a-7bcb-4057-8079-db129be3e554,11/04/2024,8,Chemistry,"Turbidity, Chloride, Sulfate, Hardness, pH, Phosphate, Alkalinity, TOC",12/02/2024,1830.69
d455a4a5-830c-486d-b0c6-2b9206cf14d8,05/16/2024,4,Chemistry,"Hardness, Sulfate, Phosphate, Chloride",06/10/2024,1088.63
451c37bd-fd7a-4f37-a4b3-166d6d2b9fe2,10/09/2023,7,Microbiology,"Total Coliforms, Cryptosporidium, Enterococci, Heterotrophic Plate Count, Giardia, Clostridium perfringens, E. coli",10/25/2023,682.67
89f7261d-8ffd-47f7-9f62-8f5b3347f380,12/21/2023,5,Chemistry,"pH, Nitrate, TOC, Heavy Metals, Hardness",01/04/2024,1409.43
410da7bf-f4de-4c5d-86d5-72069b587323,05/18/2023,3,Microbiology,"Pseudomonas aeruginosa, Giardia, Heterotrophic Plate Count",05/30/2023,429.02
f40949f4-08c8-4ee2-89c9-ad2811ccf5a7,01/07/2024,10,Microbiology,"Cryptosporidium, E. coli, Heterotrophic Plate Count, Clostridium perfringens, Enterococci, Giardia, Total Coliforms, Fecal Streptococci, Legionella, Pseudomonas aeruginosa",01/12/2024,1271.24
8c447609-c3fe-4636-9fc0-e4ca828aa198,08/15/2023,1,Chemistry,Chloride,09/08/2023,165.14
39601f1a-54c3-4c5d-8d00-2f8a905acec4,01/01/2024,1,Chemistry,pH,01/12/2024,209.29
b156e2b0-1bcc-41b6-a40c-9d9509cec1c1,10/16/2023,2,Chemistry,"Nitrate, pH",NaN,543.03
46831400-f511-412b-9ff6-bb6d9e5d8bb0,11/08/2023,8,Chemistry,"Chloride, Hardness, pH, Sulfate, Nitrate, Alkalinity, Turbidity, TOC",11/14/2023,1035.07
649dac2b-4524-4379-9d0c-4090724fb9d2,12/12/2023,8,Microbiology,"Enterococci, Clostridium perfringens, E. coli, Total Coliforms, Cryptosporidium, Legionella, Fecal Streptococci, Heterotrophic Plate Count",12/29/2023,886.03
7beb6e40-67c6-44b5-824b-39b76a4e2eb6,02/21/2023,7,Chemistry,"Turbidity, Hardness, pH, Heavy Metals, TOC, Nitrate, Chloride",03/12/2023,1061.66
25934236-9481-4aea-bba0-1b98fb743275,12/05/2023,7,Chemistry,"Phosphate, Nitrate, pH, TOC, Sulfate, Hardness, Alkalinity",12/08/2023,1335.96
020e04a7-422b-4302-aeb9-a07ef26700e4,03.27.2024,5,Microbiology,"Cryptosporidium, Fecal Streptococci, E. coli, Legionella, Giardia",04/24/2024,1309.04
4650912b-5920-4301-a317-a1f5e99603f1,04/10/2025,5,Microbiology,"Enterococci, Cryptosporidium, Fecal Streptococci, Legionella, Heterotrophic Plate Count",05/09/2025,1199.48
148bb136-24b6-4290-b70e-2f1bac4d85fd,07/08/2023,9,Microbiology,"Legionella, Pseudomonas aeruginosa, Giardia, Clostridium perfringens, E. coli, Heterotrophic Plate Count, Cryptosporidium, Fecal Streptococci, Enterococci",07/26/2023,2129.97
543ff4c2-6aa2-4f8d-839a-a1283ae063e6,09/14/2024,4,Microbiology,"Enterococci, E. coli, Clostridium perfringens, Heterotrophic Plate Count",09/26/2024,823.24
58a07912-0fbb-4ee9-b74a-012b16e1cfef,01/03/2024,3,Microbiology,"E. coli, Enterococci, Total Coliforms",01/09/2024,698.84
e31d13c9-16fc-49b5-9de9-0c33a1445024,03/30/2024,10,Microbiology,"Clostridium perfringens, E. coli, Enterococci, Heterotrophic Plate Count, Legionella, Giardia, Pseudomonas aeruginosa, Cryptosporidium, Total Coliforms, Fecal Streptococci",04/09/2024,2069.69
b3b0c594-960b-4494-9985-da82a5f4ac9c,01/04/2025,6,Microbiology,"Clostridium perfringens, Cryptosporidium, Heterotrophic Plate Count, Giardia, Enterococci, Legionella",02/03/2025,1199.66
4b8ed886-4b50-4fac-9a75-852795333a23,03/12/2024,8,Chemistry,"Nitrate, Turbidity, Heavy Metals, Phosphate, Hardness, TOC, pH, Chloride",04/10/2024,791.22
88947cd0-a657-4a92-b549-4eceac922aad,09/20/2024,4,Microbiology,"Heterotrophic Plate Count, Enterococci, E. coli, Pseudomonas aeruginosa",10/05/2024,1107.16
bf6690fe-b21d-4cc4-b57c-12f953568739,03/06/2024,4,Microbiology,"Total Coliforms, Fecal Streptococci, Cryptosporidium, Clostridium perfringens",03/15/2024,336.2
413c700c-b49f-4a63-b1e0-6076f7cee3da,12/09/2024,5,Microbiology,"Total Coliforms, E. coli, Pseudomonas aeruginosa, Fecal Streptococci, Legionella",12/25/2024,753.39
dc014a45-6ca2-4825-934a-4314fad56739,11/03/2024,8,Microbiology,"Giardia, E. coli, Total Coliforms, Cryptosporidium, Heterotrophic Plate Count, Legionella, Fecal Streptococci, Clostridium perfringens",11/17/2024,925.15
1d64a8a7-2639-4c9c-b817-8a8aa222ec0e,10/17/2023,5,Microbiology,"Enterococci, Fecal Streptococci, Pseudomonas aeruginosa, Giardia, E. coli",11/09/2023,1165.5
88ab2ad1-25b1-4330-b1fb-ef413b8cfa90,09/19/2024,8,Microbiology,"Total Coliforms, Clostridium perfringens, Legionella, Pseudomonas aeruginosa, Giardia, Enterococci, Heterotrophic Plate Count, E. coli",10/14/2024,702.49
555eaef0-e257-49fd-a56b-94338534149a,11/21/2024,7,Chemistry,"pH, Chloride, Turbidity, Heavy Metals, Hardness, TOC, Alkalinity",11/27/2024,1245.23
1cb18edb-3495-4f4e-b706-279b35df4f2c,03/15/2023,6,Chemistry,"Hardness, Chloride, pH, Sulfate, Alkalinity, Nitrate",04/11/2023,1618.38
a9e7f526-dc5d-4413-91ad-38d5db31acfa,03/22/2025,7,Microbiology,"Pseudomonas aeruginosa, Cryptosporidium, E. coli, Giardia, Legionella, Clostridium perfringens, Enterococci",04/21/2025,1678.93
5cbba076-6d3e-4ddc-b460-70874c72d0bc,08/23/2024,1,Microbiology,Clostridium perfringens,09/08/2024,185.02
effc0403-8916-465c-9cd8-a8d386420420,11/16/2024,6,Chemistry,"Turbidity, Nitrate, Hardness, Phosphate, Chloride, Alkalinity",12/15/2024,1759.93
ba0c9a38-6ce4-4fd8-8766-6df684af8020,14-12-2024,2,Chemistry,"Turbidity, Phosphate",12/26/2024,196.45
a97c2978-db13-4fba-a8b5-c3bae08a5ef8,10/31/2023,4,Microbiology,"Pseudomonas aeruginosa, Clostridium perfringens, Giardia, Heterotrophic Plate Count",11/21/2023,396.0
64ddac3a-33c1-48c3-bc9f-a7095b54f63b,11/24/2023,3,Microbiology,"E. coli, Heterotrophic Plate Count, Legionella",12/07/2023,809.25
3e436e95-ce62-4d52-8709-0efdc63cad01,12/09/2023,7,Microbiology,"Legionella, E. coli, Enterococci, Cryptosporidium, Giardia, Pseudomonas aeruginosa, Total Coliforms",12/12/2023,994.53
cb13e80b-5956-4b09-8b77-885dfd7b3b2f,05/21/2023,8,Microbiology,"Fecal Streptococci, Cryptosporidium, Heterotrophic Plate Count, Enterococci, E. coli, Clostridium perfringens, Legionella, Pseudomonas aeruginosa",NaN,1542.67
d4aa15ea-b8cf-44c8-b9d0-e92816961b19,05/11/2024,4,Chemistry,"Turbidity, pH, Nitrate, Hardness",05/21/2024,771.22
7ca6d3dc-5b65-416c-8607-b463feb012a3,12/21/2024,7,Microbiology,"Giardia, Legionella, Total Coliforms, Clostridium perfringens, Heterotrophic Plate Count, Fecal Streptococci, Cryptosporidium",01/16/2025,1392.46
40063906-fae6-4209-911c-8a289264b88d,03/12/2025,3,Chemistry,"Chloride, Heavy Metals, pH",04/04/2025,809.84
7cb0128a-6acd-4bb6-aba6-60cdbb3f451d,05/02/2023,8,Chemistry,"Alkalinity, Hardness, TOC, Sulfate, Phosphate, Chloride, pH, Heavy Metals",05/11/2023,1433.67
a6e633b1-3cf3-4eb0-bec2-738fac9f1e5b,06/28/2024,3,Microbiology,"Legionella, Total Coliforms, Heterotrophic Plate Count",NaN,261.46
0f460074-cd0c-460f-b317-36511df9c376,20-12-2024,2,Microbiology,"Total Coliforms, E. coli",01/18/2025,209.33
016d98c3-7694-4c13-be96-3a8431c36d15,04/06/2024,3,Microbiology,"Clostridium perfringens, Giardia, Fecal Streptococci",04/26/2024,465.36
