Request_ID,Sample_Received_Date,Number_of_Tests,Test_Type,Test_Names,Final_CofA_Date,Revenue
be4db0c6-5d06-4688-a19a-ab678b49eab1,03/11/2024,1,Chemistry,Nitrate,03/21/2024,199.2
cf84158a-abda-48d1-a61c-19a9c8a89f51,11/29/2023,7,Chemistry,"Sulfate, Alkalinity, Heavy Metals, Phosphate, Turbidity, Chloride, pH",12/06/2023,1484.92
051a7fe3-919e-474b-bb58-b7289c346c05,04/27/2024,9,Chemistry,"Heavy Metals, pH, Turbidity, TOC, Sulfate, Alkalinity, Phosphate, Nitrate, Chloride",05/11/2024,1509.07
fe3460da-4343-4915-813c-dfb236101a7d,11/20/2023,10,Chemistry,"Hardness, Heavy Metals, Sulfate, TOC, Phosphate, Nitrate, Turbidity, Alkalinity, pH, Chloride",12/01/2023,2047.36
55c8ef54-b18c-464a-b718-0b8f7ecc3c91,05/29/2023,2,Chemistry,"Heavy Metals, Nitrate",06/28/2023,5000
0ed999a5-180f-4e71-865c-c783f56608bd,07/13/2024,2,Microbiology,"Pseudomonas aeruginosa, Fecal Streptococci",08/08/2024,199.3
5f6f2f75-a350-4dec-9ef8-65a469a38738,06/14/2024,9,Chemistry,"Chloride, Nitrate, Sulfate, pH, TOC, Alkalinity, Turbidity, Heavy Metals, Hardness",07/02/2024,1398.27
823bf876-88bb-4095-8c4a-f514134b91f4,10/11/2024,10,Microbiology,"Cryptosporidium, Heterotrophic Plate Count, Legionella, E. coli, Fecal Streptococci, Clostridium perfringens, Enterococci, Giardia, Pseudomonas aeruginosa, Total Coliforms",11/05/2024,1046.55
cbb20400-2e28-468e-8bcd-9dbbf8886759,01/08/2023,9,Chemistry,"pH, Nitrate, Sulfate, Chloride, Heavy Metals, Alkalinity, TOC, Hardness, Turbidity",01/12/2023,2279.08
b22e47d8-a9d0-4bd4-8a7f-9c51113a5bab,06/17/2023,1,Chemistry,pH,07/14/2023,235.94
723f7cf9-f679-4255-a486-9970e94beccf,09/14/2024,6,Microbiology,"Pseudomonas aeruginosa, Heterotrophic Plate Count, Cryptosporidium, Enterococci, Total Coliforms, Fecal Streptococci",09/26/2024,895.21
a2e39483-79ce-4c15-a466-70d5f71b837c,10/09/2023,3,Chemistry,"Phosphate, Heavy Metals, Chloride",11/08/2023,374.31
5bfa0430-b7cd-410d-8626-a770f54f005d,11/24/2023,10,Chemistry,"Phosphate, Nitrate, Sulfate, pH, Turbidity, Hardness, Chloride, TOC, Heavy Metals, Alkalinity",12/15/2023,929.33
7800c3ea-f54f-4934-b12e-9127f5fffd14,03/16/2023,4,Microbiology,"Legionella, Cryptosporidium, Total Coliforms, Pseudomonas aeruginosa",04/09/2023,1135.95
5362826a-b755-4b20-ba92-a03e114bd075,10/07/2024,6,Chemistry,"Chloride, Sulfate, Alkalinity, pH, Hardness, Turbidity",10/27/2024,916.42
3ab45219-742b-48b9-9097-ed5bb0044b9b,03/15/2024,6,Chemistry,"Heavy Metals, Chloride, Turbidity, TOC, Hardness, Nitrate",05-04-2024,1701.25
8041b5f2-20bc-4a79-9f1d-8dc20e00a67a,08/14/2024,1,Microbiology,Clostridium perfringens,08/17/2024,156.2
9e187a01-2aef-4635-b481-44ff36a0ed5f,05/08/2023,3,Microbiology,"Fecal Streptococci, Total Coliforms, E. coli",05/19/2023,730.72
54cc4a13-d86e-42e1-bad2-560c9507027f,08/24/2023,4,Microbiology,"Legionella, Giardia, Clostridium perfringens, Fecal Streptococci",09/06/2023,1013.13
68589aae-ab5c-4316-8df8-cdaee884174a,09/12/2024,6,Microbiology,"Legionella, Fecal Streptococci, Cryptosporidium, Enterococci, Pseudomonas aeruginosa, Clostridium perfringens",09/29/2024,1107.79
237dbf03-6c2a-4101-972c-7e9970a8eb7f,01/28/2024,4,Microbiology,"Heterotrophic Plate Count, E. coli, Pseudomonas aeruginosa, Enterococci",02/13/2024,1071.83
fa0faeb0-6ba3-4797-8523-43a7edb7a0d2,09/30/2023,1,Chemistry,pH,10/19/2023,160.41
43032484-b3b5-4251-a350-e0c2d39f7f55,11/23/2023,4,Microbiology,"Clostridium perfringens, Heterotrophic Plate Count, Fecal Streptococci, Cryptosporidium",12/10/2023,619.46
55e2a7ed-0873-4883-90f9-007d985bec80,02/24/2024,7,Microbiology,"E. coli, Heterotrophic Plate Count, Giardia, Enterococci, Legionella, Total Coliforms, Pseudomonas aeruginosa",03/23/2024,932.96
57082c03-059f-4db2-a3f0-7a85270a0c6e,03/20/2024,6,Chemistry,"Phosphate, Hardness, Turbidity, Chloride, pH, Alkalinity",03/23/2024,1202.69
5caed9f3-699e-4802-9242-acd35190abd9,03/22/2023,4,Chemistry,"Heavy Metals, Hardness, Alkalinity, TOC",04/11/2023,917.75
09675fdb-572d-4420-be85-5c3baae021d4,06/27/2023,7,Chemistry,"pH, Sulfate, Chloride, Alkalinity, Heavy Metals, Turbidity, Hardness",07/06/2023,1320.67
470ad392-4106-4da8-82e6-386eaa3aa0ee,04/12/2025,1,Chemistry,pH,05/09/2025,244.39
508bd9d7-c7b7-45e9-968c-fab7ef122601,01/05/2023,3,Microbiology,"Total Coliforms, Cryptosporidium, E. coli",01/10/2023,360.4
63aad7ef-ac4f-4828-b508-2e262f0db84e,12/23/2024,8,Microbiology,"Total Coliforms, Giardia, Legionella, E. coli, Pseudomonas aeruginosa, Fecal Streptococci, Enterococci, Cryptosporidium",12/30/2024,1754.52
8dbfc5ad-481a-4d1a-95ef-980d5d18e701,03/20/2023,6,Microbiology,"Giardia, Pseudomonas aeruginosa, Total Coliforms, Enterococci, Clostridium perfringens, Heterotrophic Plate Count",04/13/2023,1795.73
1dd03eff-0e0d-4a07-9796-9c37d94adf65,01/29/2025,1,Microbiology,Pseudomonas aeruginosa,02/17/2025,126.38
0db598fb-6d7e-48b1-b77f-c208f3a41470,03/24/2024,5,Chemistry,"Hardness, TOC, Chloride, Alkalinity, Nitrate",04/14/2024,1164.59
2ced99ef-60cf-41c8-b096-cec0fd9e2047,04/10/2023,1,Microbiology,Giardia,05/01/2023,228.32
33b52cb4-d6b6-4011-ac7a-e51f1195f49d,12/23/2024,8,Chemistry,"Chloride, Sulfate, Hardness, Phosphate, Nitrate, Alkalinity, Turbidity, pH",01/06/2025,1807.04
89124ad7-8f44-4874-bc8f-38506e4a6f6e,08/13/2023,7,Chemistry,NaN,09/03/2023,1762.7
ce0babdd-3a31-4d2a-bfef-d90d78a2748b,05/20/2023,9,Chemistry,"TOC, Turbidity, pH, Sulfate, Hardness, Alkalinity, Heavy Metals, Phosphate, Chloride",06/18/2023,NaN
fefd1d62-e14b-499b-be85-4a35d790ec56,06/20/2024,10,Chemistry,"Chloride, Heavy Metals, Turbidity, TOC, Hardness, Alkalinity, Phosphate, Nitrate, Sulfate, pH",06/23/2024,899.79
6ffb02a7-fbf8-4fd2-83b7-661455418147,02/25/2025,4,Chemistry,"Phosphate, Chloride, TOC, Nitrate",03/19/2025,618.04
5dfeb4a3-a5ab-4b9c-8367-e2a4f8c5d31a,06/26/2023,2,Microbiology,"Pseudomonas aeruginosa, Clostridium perfringens",07/03/2023,NaN
ad742ac1-d09b-45ac-89f1-33695dc9c28f,04/23/2024,2,Chemistry,"Sulfate, pH",05/12/2024,583.65
08dad981-fbc6-4f8e-a2c8-215f84b9c815,11/22/2023,4,Microbiology,"Fecal Streptococci, Giardia, Enterococci, Pseudomonas aeruginosa",12/04/2023,966.19
e65ceab8-e24e-466b-a3fd-d5182f25418f,09/29/2024,9,Chemistry,"pH, Turbidity, Heavy Metals, Hardness, Nitrate, Chloride, Phosphate, Sulfate, Alkalinity",10/04/2024,920.42
5ddb791f-5001-4fa9-88ce-9d1e67872905,01/21/2024,1,Chemistry,Hardness,NaN,229.13
53002b22-da29-4213-87c0-4e3fbb59604e,05/14/2023,4,Microbiology,"Legionella, Clostridium perfringens, Giardia, Fecal Streptococci",06/06/2023,1117.38
5500a256-9f1e-425e-8c55-0b3574d2404a,02/09/2023,1,Chemistry,NaN,NaN,279.71
47c71a79-5318-4f14-834c-263d80e3f8d1,01/29/2024,8,Microbiology,"Legionella, Fecal Streptococci, Total Coliforms, Pseudomonas aeruginosa, Giardia, Cryptosporidium, Clostridium perfringens, E. coli",02/09/2024,691.51
817eacfb-2b22-4bd0-bd51-10ca3a64750b,01/03/2025,4,Chemistry,"Nitrate, pH, Alkalinity, Sulfate",01/15/2025,5000
8fb1b041-7706-42cf-bb55-ac021fcb5076,10/29/2023,9,Chemistry,NaN,11/21/2023,NaN
e3b05425-53b6-4de9-806c-9cbd1a9334a6,05/27/2023,6,Chemistry,"Heavy Metals, pH, Nitrate, Phosphate, Hardness, Chloride",06/23/2023,1340.18
53df53e3-2b0e-4c98-a067-a38a39830420,12/26/2023,4,Microbiology,"Enterococci, Cryptosporidium, Legionella, Total Coliforms",01/17/2024,1077.04
405a610e-1b07-480d-945c-c9d1b257bfc7,03/19/2024,2,Chemistry,"Phosphate, Nitrate",03/23/2024,423.02
10ebb395-ca97-4a7e-a5e8-72a9b4c127f9,08/07/2023,5,Microbiology,"Clostridium perfringens, Total Coliforms, Giardia, Cryptosporidium, E. coli",08/14/2023,431.65
1167f2fe-8b59-4f5a-82fb-1d5f0d61a7b2,09/11/2024,4,Microbiology,"Cryptosporidium, Giardia, Fecal Streptococci, Legionella",09/21/2024,369.11
57645084-434b-4214-a0f5-83df3f885173,08/30/2024,3,Chemistry,"Chloride, Phosphate, Nitrate",09/27/2024,346.62
08d1a7c5-e9a9-4768-a7fa-2916cb864bd9,08/03/2024,10,Chemistry,NaN,08/12/2024,1277.0
0bd0773f-f419-410b-a78f-1b08ba875017,09/12/2024,1,Microbiology,Cryptosporidium,10/02/2024,183.92
f3364078-8156-447a-b6df-ec3f15562a07,03/28/2025,8,Chemistry,"Chloride, Phosphate, Hardness, Sulfate, Nitrate, TOC, pH, Turbidity",04/27/2025,2041.63
6973bc10-977e-4e7e-b90d-d3fd039d998f,08/25/2024,8,Microbiology,"E. coli, Cryptosporidium, Pseudomonas aeruginosa, Heterotrophic Plate Count, Enterococci, Clostridium perfringens, Giardia, Fecal Streptococci",09/15/2024,1029.16
d5d41c0c-4421-4133-a362-b5cef6af4f6f,06/02/2024,1,Chemistry,Sulfate,06/17/2024,134.17
6b616184-e8af-4915-9307-9934768807ee,07/30/2024,6,Microbiology,"Clostridium perfringens, Cryptosporidium, Pseudomonas aeruginosa, Heterotrophic Plate Count, E. coli, Total Coliforms",08/28/2024,1009.24
44ea0ded-10c9-49c0-8b5a-ade8edb6b01d,11/23/2023,3,Chemistry,"Hardness, Chloride, pH",11/28/2023,654.89
a61b0dff-b3e9-4989-bf4b-949cdf77714e,01/05/2024,4,Microbiology,"Pseudomonas aeruginosa, E. coli, Fecal Streptococci, Giardia",01/13/2024,1013.0
7633d712-e16c-4a25-be94-04e1a1ae29ac,04/07/2023,5,Chemistry,"Heavy Metals, Phosphate, TOC, Hardness, Nitrate",05/02/2023,10
62e7d2ac-8cfd-4c98-b8f8-e2ceade1bee7,05/17/2024,4,Microbiology,"E. coli, Giardia, Clostridium perfringens, Pseudomonas aeruginosa",06/04/2024,718.49
e3f68218-2a93-429f-a8bb-69242b1d3eea,12/12/2023,8,Chemistry,"pH, Phosphate, Hardness, TOC, Chloride, Nitrate, Heavy Metals, Alkalinity",12/15/2023,1615.4
cbca0b1b-dc3c-4748-8935-3910d93057be,04/14/2023,6,Chemistry,"TOC, Heavy Metals, Nitrate, pH, Phosphate, Hardness",05/06/2023,1574.25
9c333a75-c6e1-44e0-8132-7c29643da5e7,01/31/2023,1,Chemistry,Phosphate,02/13/2023,125.69
9b77407a-9623-4c34-aae3-987f3402c710,10/03/2023,2,Chemistry,"TOC, Turbidity",10/19/2023,404.0
8eaa212a-e6b4-458b-9cfb-602e8901bb5c,05/02/2023,6,Chemistry,"TOC, Chloride, Nitrate, Turbidity, Sulfate, Phosphate",05/21/2023,627.1
0533d7ec-5823-4fe6-83fd-7fbe23e67d09,06/23/2023,1,Chemistry,Sulfate,07/15/2023,160.22
5e4fd236-3df2-4270-8aba-b6850301480b,03/04/2025,7,Chemistry,"Chloride, Turbidity, TOC, Phosphate, Hardness, Nitrate, Sulfate",03/25/2025,912.89
79d9d01e-5812-4bd0-a54f-7052747a4b7a,01/13/2024,8,Chemistry,"Heavy Metals, Turbidity, Chloride, Sulfate, TOC, Alkalinity, Nitrate, Phosphate",01/30/2024,869.14
baee66c7-3e34-4db2-87ae-03b12123a29b,06/02/2023,1,Chemistry,Sulfate,06/05/2023,87.33
b5c15a10-2338-4372-b7a3-4a0610efeaa9,03/07/2024,3,Chemistry,"Hardness, Nitrate, pH",04/01/2024,331.78
0607e7b8-f949-406c-aa08-40199fe8c050,02/25/2024,9,Chemistry,"Phosphate, Sulfate, Heavy Metals, Chloride, Turbidity, Nitrate, TOC, pH, Hardness",03/10/2024,2168.65
4874b106-eb5d-40f8-a3e9-2bef1896921a,04/11/2024,4,Microbiology,"Pseudomonas aeruginosa, Total Coliforms, Legionella, E. coli",04.24.2024,1138.15
80433710-ebeb-42e3-aff5-28638a446e9b,07/18/2024,5,Microbiology,"Clostridium perfringens, Total Coliforms, Legionella, Giardia, Heterotrophic Plate Count",08/17/2024,949.72
d947e698-3d09-4baa-8dc2-f8cf1f9e2939,02/10/2023,10,Chemistry,"Turbidity, Alkalinity, Phosphate, pH, Nitrate, Chloride, Heavy Metals, TOC, Hardness, Sulfate",02/23/2023,2860.41
f4f7ce95-ce47-463c-8e94-425d1155df80,10/25/2024,1,Microbiology,Clostridium perfringens,NaN,294.57
62e81edb-b159-440a-bc0a-b8044a78bccc,03/13/2024,7,Chemistry,"Nitrate, pH, Phosphate, Chloride, Heavy Metals, TOC, Sulfate",03/18/2024,947.47
fbc184d5-3275-4eea-a951-4c5d0af80228,02/20/2025,7,Chemistry,"Nitrate, pH, Sulfate, TOC, Turbidity, Heavy Metals, Chloride",02/28/2025,1798.64
4ce9eb77-b3a9-426b-91db-917a1ae88b81,04/07/2025,8,Microbiology,"Giardia, Cryptosporidium, Total Coliforms, E. coli, Enterococci, Legionella, Pseudomonas aeruginosa, Fecal Streptococci",05/07/2025,1984.56
ee12b0d3-315b-4919-8d8f-6814526df49d,03/04/2025,8,Chemistry,"Chloride, Phosphate, Nitrate, Hardness, Heavy Metals, pH, Alkalinity, TOC",03/08/2025,10000
0eeb0fce-2431-4168-9ced-c82a4a2fb1ef,01/04/2023,7,Chemistry,"Alkalinity, Chloride, TOC, Nitrate, Sulfate, Heavy Metals, pH",2023/01/14,718.49
8112d832-3661-4f34-9e24-3d89c3ae04e0,12/02/2023,7,Microbiology,"Legionella, Giardia, E. coli, Fecal Streptococci, Total Coliforms, Enterococci, Clostridium perfringens",12/12/2023,1751.45
5cc65226-befc-4a42-b616-f3e408a8a695,01/05/2023,10,Microbiology,"Total Coliforms, Legionella, Enterococci, Giardia, Heterotrophic Plate Count, Clostridium perfringens, E. coli, Pseudomonas aeruginosa, Cryptosporidium, Fecal Streptococci",02/04/2023,1410.8
d9a91d23-5a58-45eb-b90d-8994a999d14b,01/09/2025,5,Chemistry,"Sulfate, Alkalinity, Nitrate, Hardness, TOC",02/01/2025,1110.62
8a3cd8e2-d875-49d8-8616-071336f6e6a2,03/15/2024,5,Chemistry,"Chloride, Turbidity, Alkalinity, pH, Nitrate",03/21/2024,966.7
abfce290-2be8-4001-9820-48050cdfc860,09/03/2024,4,Microbiology,"Heterotrophic Plate Count, E. coli, Enterococci, Cryptosporidium",09/08/2024,644.34
1cc70364-6c9a-4377-ad71-0f145701f492,05/06/2024,1,Chemistry,pH,05/25/2024,149.97
c21be0c6-bf76-4347-83ac-2be24aae5eb0,09/28/2024,6,Microbiology,"Total Coliforms, E. coli, Clostridium perfringens, Fecal Streptococci, Pseudomonas aeruginosa, Giardia",10/20/2024,1429.79
92360ccb-59ce-43b7-a7f2-040a7387fc3b,04/28/2023,3,Microbiology,"Enterococci, Clostridium perfringens, Fecal Streptococci",05/03/2023,256.86
3557c098-98de-439e-ab84-1ce418207227,01/30/2023,5,Chemistry,"TOC, Nitrate, Hardness, Sulfate, Phosphate",02/07/2023,765.53
dab08d18-5023-47c8-b2aa-2419800247f5,02/17/2024,9,Microbiology,NaN,03/17/2024,2268.65
8ccb9359-1c78-4bd2-8ac2-7caaf724f2d1,10/13/2024,10,Microbiology,"Pseudomonas aeruginosa, Enterococci, Total Coliforms, E. coli, Giardia, Fecal Streptococci, Heterotrophic Plate Count, Clostridium perfringens, Cryptosporidium, Legionella",10/30/2024,2991.23
985acae8-bdcb-4086-be35-3b581f2b4880,05/29/2024,3,Chemistry,"Alkalinity, Hardness, Turbidity",06/10/2024,852.76
2ff9dfb9-5e3a-4919-9a87-d45e370da062,02/20/2025,1,Chemistry,Phosphate,NaN,194.36
9db41ec2-eff8-4f62-b955-a66dd2624fef,07/15/2024,4,Chemistry,"Heavy Metals, Nitrate, Sulfate, Phosphate",08/02/2024,547.18
43d06efe-1d57-4e9e-bdbe-8b51e37f5eef,04/01/2024,4,Chemistry,"pH, Sulfate, Turbidity, TOC",04/12/2024,NaN
5403937e-e59b-4c8e-b206-d9998e1cd643,03/28/2024,6,Chemistry,"Phosphate, Turbidity, Alkalinity, TOC, pH, Heavy Metals",04/07/2024,1111.53
1cdfc49f-3207-4f48-8f1f-34094f78381d,03/10/2023,1,Chemistry,TOC,NaN,NaN
847e8671-ca14-4e27-87fb-630a1cdd36fc,08/27/2023,1,Microbiology,Enterococci,09/23/2023,288.88
8cabebf2-97f1-4244-adc4-330add734b2b,03/24/2023,3,Chemistry,"Heavy Metals, Hardness, pH",03/28/2023,782.37
ccf4a8c6-acfb-450f-9b1f-827bd83e8e00,08/08/2023,4,Chemistry,NaN,08/28/2023,693.0
2f39ec73-428a-42a9-8a88-ece5726040ff,09/16/2023,8,Microbiology,"Enterococci, Clostridium perfringens, Giardia, Cryptosporidium, Pseudomonas aeruginosa, Heterotrophic Plate Count, Fecal Streptococci, E. coli",10/02/2023,1050.06
f5e06e05-a2dd-4d83-9f0a-c2b0fb4a682c,09/09/2024,9,Microbiology,"Fecal Streptococci, Pseudomonas aeruginosa, Cryptosporidium, Giardia, E. coli, Total Coliforms, Legionella, Enterococci, Heterotrophic Plate Count",09/15/2024,2162.31
6ef4b3ba-00de-4f1e-a652-c72d336cb8fe,06/06/2023,10,Chemistry,"Turbidity, Heavy Metals, Hardness, Sulfate, pH, Nitrate, Phosphate, TOC, Chloride, Alkalinity",06/17/2023,1410.66
84de6219-184e-408a-9765-fcef6d591dc5,06/07/2023,8,Microbiology,"Clostridium perfringens, Enterococci, Giardia, Fecal Streptococci, Pseudomonas aeruginosa, E. coli, Heterotrophic Plate Count, Total Coliforms",06/25/2023,NaN
fdf221a0-b5a4-4de1-b872-e327d12397b9,05.13.2024,10,MICROBIOLOGY,"Giardia, Legionella, Clostridium perfringens, E. coli, Enterococci, Cryptosporidium, Pseudomonas aeruginosa, Fecal Streptococci, Total Coliforms, Heterotrophic Plate Count",05/31/2024,2385.05
2789e9e5-2430-4317-bd96-abfbe0f9ae7c,11/24/2023,9,Microbiology,"E. coli, Enterococci, Giardia, Pseudomonas aeruginosa, Fecal Streptococci, Heterotrophic Plate Count, Legionella, Clostridium perfringens, Total Coliforms",12/24/2023,1967.33
cc9ef65f-a135-4a8e-8ab0-2a6cbd5e0d6f,01/25/2023,2,Microbiology,"Legionella, Enterococci",02/04/2023,406.44
1a6565de-2e35-4886-ad10-648245b856ed,10/24/2024,4,Microbiology,"E. coli, Total Coliforms, Clostridium perfringens, Pseudomonas aeruginosa",11/14/2024,1028.05
7e01fde9-ea09-43dd-aa43-164f6c9e1907,12/23/2023,2,Microbiology,"E. coli, Pseudomonas aeruginosa",01/20/2024,453.75
e58e47e9-824f-435e-955f-594430bf1584,06/04/2024,6,Chemistry,"Hardness, pH, Phosphate, Sulfate, TOC, Alkalinity",06/27/2024,1158.75
1a936d21-0509-410c-ada1-9fd6fc58aeea,06/27/2023,7,Microbiology,NaN,07/14/2023,1825.19
99a007af-f655-4842-9be2-2634fb9350ba,12/05/2023,7,Microbiology,"Cryptosporidium, Heterotrophic Plate Count, Enterococci, Legionella, Clostridium perfringens, Pseudomonas aeruginosa, E. coli",12/27/2023,1691.25
5e19d286-e033-4931-83a4-c4e035b5853e,03/05/2024,2,Microbiology,"Giardia, Clostridium perfringens",03/25/2024,380.98
bd59ec95-bc03-4951-86ed-fa95ec00f7d6,12/31/2023,2,Microbiology,"Cryptosporidium, Giardia",01/16/2024,339.91
6930fd06-e365-48e8-9758-204b11df8b2f,08/18/2023,6,Microbiology,"Heterotrophic Plate Count, Fecal Streptococci, Legionella, Enterococci, Giardia, E. coli",08/23/2023,1517.2
d1264731-acb4-461b-8250-36678453f888,09/11/2023,3,Chemistry,"Phosphate, pH, TOC",10/08/2023,262.43
bb2938fc-aec3-429d-9e2d-980aaf412be0,11/09/2023,3,Chemistry,NaN,12/03/2023,243.04
088e33a3-c4b9-4c91-86e5-620b82c64a4f,01/12/2024,4,Microbiology,"Fecal Streptococci, Enterococci, Cryptosporidium, E. coli",01/31/2024,NaN
1de86f75-5bd3-44c8-a18e-f7639705adfd,03/31/2023,7,Microbiology,"Pseudomonas aeruginosa, Legionella, Giardia, Enterococci, Cryptosporidium, Total Coliforms, Clostridium perfringens",04/09/2023,1671.04
c33cff9d-7771-4b35-8d79-4942c5dc7a3d,02/28/2023,8,Chemistry,"Hardness, Sulfate, pH, Phosphate, Turbidity, Alkalinity, Chloride, Nitrate",03/14/2023,1103.06
b9680ab9-0824-407d-bb58-a4d2c869ba1f,09/23/2024,5,Microbiology,"Legionella, Heterotrophic Plate Count, Pseudomonas aeruginosa, Clostridium perfringens, Fecal Streptococci",10.08.2024,881.3
57179630-d61f-4f7f-845c-bb730e952460,02/01/2024,8,Chemistry,"Alkalinity, pH, Phosphate, Sulfate, Nitrate, Chloride, TOC, Turbidity",02/10/2024,696.87
ba4854e8-8a35-4da3-a37d-351c5569cfbd,01/12/2023,2,Chemistry,"Alkalinity, Nitrate",01/18/2023,546.32
faa77364-7b4e-4555-ae23-771c369eaa81,10/26/2023,4,Microbiology,"Total Coliforms, Fecal Streptococci, Giardia, Enterococci",11/15/2023,1003.11
0446fb2a-eb33-46b8-be14-c3dca1cea179,06/21/2024,8,Microbiology,"E. coli, Heterotrophic Plate Count, Enterococci, Legionella, Clostridium perfringens, Total Coliforms, Giardia, Cryptosporidium",06/24/2024,993.18
0b634265-2f65-42be-92e0-8cd996d504d3,09/10/2024,9,Microbiology,"Cryptosporidium, Enterococci, Total Coliforms, Clostridium perfringens, Pseudomonas aeruginosa, Fecal Streptococci, Giardia, Heterotrophic Plate Count, Legionella",09/29/2024,893.93
8d244951-28dd-45e7-9455-0b9dec9aa1e5,06/06/2023,5,Microbiology,"Clostridium perfringens, Giardia, Cryptosporidium, Legionella, Total Coliforms",06/21/2023,1448.99
7f5c64f3-fc29-4c24-9002-e4b76bec3f56,08/18/2024,10,chemistry,"Heavy Metals, Hardness, pH, Turbidity, Chloride, Phosphate, Sulfate, Nitrate, Alkalinity, TOC",09/11/2024,2508.15
9cfce890-5a7b-4646-9edb-f27ec38f4b77,10/28/2024,10,Microbiology,NaN,11/21/2024,1364.95
1cda4042-5d7c-4a67-bc7e-1aa1b9e1f9f3,12/22/2023,3,Chemistry,"Chloride, Sulfate, Turbidity",12/25/2023,10
45411995-644c-4797-952a-c396110230b9,11/14/2023,9,Microbiology,"Legionella, Total Coliforms, Giardia, Cryptosporidium, Heterotrophic Plate Count, E. coli, Enterococci, Clostridium perfringens, Fecal Streptococci",11/29/2023,1276.8
1d94fb14-ea62-48ef-a74a-751362e232b3,11/26/2024,5,Chemistry,"Hardness, Heavy Metals, pH, Sulfate, Nitrate",12/01/2024,1335.39
d04b9c57-a2f9-4d58-af06-6ad3a0c393a5,08/12/2024,3,Chemistry,"TOC, Alkalinity, Sulfate",08/30/2024,312.96
10f1c513-8587-4bb5-9a6d-cc3335d74fc6,05/28/2024,8,Chemistry,"Turbidity, TOC, Heavy Metals, Phosphate, Hardness, Nitrate, Chloride, pH",06/07/2024,1729.51
897962eb-ce38-4425-b0ae-403eb15f1673,02/19/2023,10,Chemistry,"Sulfate, Nitrate, Phosphate, Turbidity, Heavy Metals, pH, Hardness, TOC, Chloride, Alkalinity",03/17/2023,2716.26
4891ed39-e735-42c6-ae13-e5731c0dc5df,01/16/2023,4,Chemistry,"Heavy Metals, Sulfate, Turbidity, Nitrate",01/28/2023,397.44
daceac8b-ac58-4511-b4c1-46448b27387f,07/03/2023,9,Microbiology,"Heterotrophic Plate Count, Fecal Streptococci, E. coli, Pseudomonas aeruginosa, Total Coliforms, Legionella, Enterococci, Clostridium perfringens, Cryptosporidium",07/12/2023,1439.73
437b7d2e-b96e-4374-b0c8-5b374a179a9e,08/06/2024,7,Chemistry,"Nitrate, Alkalinity, Turbidity, pH, Chloride, Hardness, Phosphate",08/16/2024,2082.11
1cffdd04-147a-4212-9175-e3aa8a143803,02/20/2023,8,Microbiology,"Pseudomonas aeruginosa, Cryptosporidium, Legionella, Total Coliforms, E. coli, Enterococci, Heterotrophic Plate Count, Giardia",03/08/2023,1395.58
d0ce2d0e-65c7-46a8-8bbb-e9bee5877cf5,12/22/2023,3,Chemistry,"TOC, Alkalinity, Heavy Metals",12/27/2023,496.1
a42a17cd-ad69-48b2-9070-4a0e00c13931,09/08/2023,8,Microbiology,"Legionella, Enterococci, Fecal Streptococci, Cryptosporidium, Giardia, E. coli, Heterotrophic Plate Count, Clostridium perfringens",09/13/2023,NaN
18a7e701-cf54-4c59-8aed-9386df4c7211,01/23/2025,7,Microbiology,"Heterotrophic Plate Count, Fecal Streptococci, Legionella, E. coli, Enterococci, Giardia, Cryptosporidium",02/07/2025,1162.29
9a1d466a-459b-452b-a88d-5a6bb5547b10,07/08/2023,7,Chemistry,"pH, Nitrate, Chloride, Heavy Metals, Alkalinity, Hardness, Phosphate",07/21/2023,1639.15
7035eeb2-063c-4ce1-9a74-452c49e3388a,09/13/2023,3,Microbiology,"Heterotrophic Plate Count, Clostridium perfringens, Cryptosporidium",09/30/2023,528.41
af0460bf-4ecf-4f6c-9442-8078b75d22bf,09/05/2023,2,Microbiology,"E. coli, Legionella",09/17/2023,540.12
ac6a869a-c201-4dce-bfe1-7eb6adf65e43,03/03/2025,2,Chemistry,"Nitrate, Phosphate",03/16/2025,361.91
bbb17617-c661-490d-9cc3-77b733cbd760,02/26/2024,9,Microbiology,"Clostridium perfringens, Total Coliforms, Fecal Streptococci, Cryptosporidium, Enterococci, E. coli, Legionella, Pseudomonas aeruginosa, Heterotrophic Plate Count",03/12/2024,1272.35
afb03217-6393-47ec-b903-31870478b48e,02/14/2024,6,Chemistry,"pH, TOC, Sulfate, Chloride, Alkalinity, Turbidity",03/05/2024,1224.16
1434c5a1-f0f1-4b1d-b174-bdc7724c5b0e,01/17/2024,10,Microbiology,"Clostridium perfringens, Cryptosporidium, Legionella, Fecal Streptococci, Enterococci, Total Coliforms, Pseudomonas aeruginosa, Giardia, Heterotrophic Plate Count, E. coli",01/24/2024,2873.33
72f82b8c-7040-40f3-9e78-834ee974227f,06/17/2024,2,Microbiology,"E. coli, Total Coliforms",NaN,390.96
2d37dfd5-601c-4bbb-a1a8-d5e8fb19bd0a,10/12/2023,5,Microbiology,"Legionella, Pseudomonas aeruginosa, Fecal Streptococci, E. coli, Total Coliforms",11/01/2023,1130.38
3d549ec9-6996-4326-8a8a-6987093b976d,06/01/2024,7,Chemistry,"pH, Phosphate, Sulfate, Chloride, Hardness, Turbidity, Heavy Metals",06/08/2024,894.69
86bc8f72-9f89-4c9e-b117-4434a7d60672,09/13/2024,5,Chemistry,"Turbidity, pH, Heavy Metals, Nitrate, Sulfate",09/26/2024,579.29
d9070688-36d3-41e4-bd83-6c2995e5c415,06/29/2023,4,Chemistry,"pH, Turbidity, Phosphate, Alkalinity",07/14/2023,352.24
1bd299ba-6989-4c25-97b1-a6c7e78ad512,01/28/2025,1,Chemistry,Sulfate,02/17/2025,216.33
da783687-0956-48a2-baed-ce6612721bff,05/20/2024,4,Microbiology,"Enterococci, Legionella, Clostridium perfringens, Fecal Streptococci",06/17/2024,895.58
9954a4a6-585f-45d5-92ef-13581a7c5c6c,10/09/2024,10,Chemistry,"TOC, Alkalinity, Turbidity, Chloride, Sulfate, Hardness, Heavy Metals, pH, Phosphate, Nitrate",10/31/2024,2299.21
e80e74f2-35e5-4c70-a38f-79c814516a5f,05/27/2024,10,Microbiology,"Enterococci, Fecal Streptococci, Heterotrophic Plate Count, Cryptosporidium, E. coli, Total Coliforms, Pseudomonas aeruginosa, Legionella, Clostridium perfringens, Giardia",06/08/2024,2436.64
9eca5d80-7d6d-432b-806b-0b93c1caf37e,08/14/2024,7,Chemistry,"Turbidity, Phosphate, pH, Nitrate, Hardness, Sulfate, Alkalinity",08/24/2024,1105.48
5958376e-81bc-435e-911a-8deccfc869fe,06/20/2024,9,Microbiology,"Legionella, Total Coliforms, Heterotrophic Plate Count, E. coli, Clostridium perfringens, Fecal Streptococci, Giardia, Pseudomonas aeruginosa, Enterococci",NaN,1328.21
ab6ae899-3eae-41da-83dd-a8dc3ad395a0,01/21/2024,7,Microbiology,"Total Coliforms, Heterotrophic Plate Count, Enterococci, E. coli, Clostridium perfringens, Legionella, Giardia",01/28/2024,1711.51
1a3e4b5a-9b82-42b4-8a7a-3d0d4deb10aa,10/19/2024,9,Microbiology,"Clostridium perfringens, Enterococci, Legionella, Cryptosporidium, E. coli, Pseudomonas aeruginosa, Giardia, Fecal Streptococci, Heterotrophic Plate Count",10/25/2024,959.62
9b91d946-b0a5-43a5-ad09-1b52af841508,05/29/2024,6,Chemistry,"Hardness, Turbidity, pH, Phosphate, Sulfate, Chloride",06/07/2024,1692.17
c8b7266d-a5ed-4b26-b3d5-e35eaaa1ad45,02/26/2025,3,Chemistry,"Nitrate, Alkalinity, pH",03/26/2025,743.05
837e2215-de4d-4991-aed6-c3538a3011ed,03/02/2024,2,Chemistry,"Chloride, Phosphate",03/23/2024,256.27
4cba012e-af69-4ec9-bdff-1b41cb3e922a,03/07/2023,7,Chemistry,"TOC, Hardness, Alkalinity, Sulfate, Nitrate, Chloride, Phosphate",03/16/2023,1670.13
600179bb-7829-4f3f-9a78-b7c8ffdc96f6,02/04/2023,10,Microbiology,"Cryptosporidium, Fecal Streptococci, Clostridium perfringens, Enterococci, Legionella, Giardia, Heterotrophic Plate Count, Pseudomonas aeruginosa, E. coli, Total Coliforms",02/25/2023,1479.51
e42016a5-962c-4286-8630-2c312ea12ae0,04/21/2023,6,Chemistry,"TOC, Alkalinity, Sulfate, Phosphate, pH, Chloride",05/15/2023,1202.63
e5ec2ece-3e1d-4d7c-a1fb-1f0012571d8b,09/01/2024,3,Microbiology,"Heterotrophic Plate Count, Enterococci, Clostridium perfringens",09/11/2024,515.65
2f7893a4-2abc-4102-b5b2-d7ae8733fca8,10/16/2024,2,Microbiology,"Heterotrophic Plate Count, Giardia",11/01/2024,524.24
51f3268a-fdc5-4203-beed-ce6d0c8571e3,07/01/2023,3,Microbiology,"Enterococci, Legionella, Fecal Streptococci",NaN,283.98
